{
  "schema": "aiwg.civic.correction-record.v1",
  "correction_id": "correction-1",
  "item_id": "story-1",
  "old_version": "story-1:v1",
  "new_version": "story-1:v2",
  "status_before": "superseded",
  "status_after": "usable",
  "reason_category": "factual_error",
  "public_note": "A date was corrected and the source link was updated.",
  "changed_claim_ids": ["claim-2"],
  "source_refs": ["source-2:retrieval-3"],
  "reviewer": "correction-editor-human",
  "downstream_targets": [{"target": "owned-site", "state": "observed", "evidence": "deployment-receipt-1"}]
}
